{"version":1,"agent_radius":0.40000001,"agent_height":2.00000000,"vertices":[[-8.00000000,0.00000000,-4.00000000],[-5.25000000,0.00000000,-3.12500000],[-2.50000000,0.00000000,-4.00000000],[-2.50000000,0.00000000,-2.25000000],[-3.75000000,0.00000000,-2.25000000],[-6.25000000,0.00000000,-2.25000000],[-8.00000000,0.00000000,-2.25000000],[2.50000000,2.00000000,-4.00000000],[5.25000000,2.00000000,0.00000000],[8.00000000,2.00000000,-4.00000000],[8.00000000,2.00000000,4.00000000],[2.50000000,2.00000000,4.00000000],[2.50000000,2.00000000,1.75000000],[2.50000000,2.00000000,-1.75000000],[-7.12500000,0.00000000,0.87500000],[-6.25000000,0.00000000,0.25000000],[-6.25000000,0.00000000,4.00000000],[-8.00000000,0.00000000,4.00000000],[-3.12500000,0.00000000,0.87500000],[-2.50000000,0.00000000,-1.75000000],[-2.50000000,0.00000000,1.75000000],[-2.50000000,0.00000000,4.00000000],[-3.75000000,0.00000000,4.00000000],[-3.75000000,0.00000000,0.25000000],[-2.00000000,0.00000000,1.75000000],[-2.00000000,0.00000000,-1.75000000],[2.00000000,2.00000000,1.75000000],[2.00000000,2.00000000,-1.75000000],[10.00000000,0.00000000,0.00000000],[12.00000000,0.00000000,2.00000000],[12.00000000,0.00000000,0.00000000],[10.00000000,0.00000000,2.00000000]],"triangles":[[0,1,2],[2,1,3],[3,1,4],[4,1,5],[5,1,6],[6,1,0],[7,8,9],[9,8,10],[10,8,11],[11,8,12],[12,8,13],[13,8,7],[6,14,5],[5,14,15],[15,14,16],[16,14,17],[17,14,6],[4,18,3],[3,18,19],[19,18,20],[20,18,21],[21,18,22],[22,18,23],[23,18,4],[19,24,25],[19,20,24],[25,26,27],[25,24,26],[27,12,13],[27,26,12],[28,29,30],[28,31,29],[15,22,23],[15,16,22]]}