{
  "$schema": "../../schemas/navmesh.schema.json",
  "version": 1,
  "agent_radius": 0.4,
  "agent_height": 2,
  "vertices": [
    [
      -8.0,
      0.0,
      -4.0
    ],
    [
      -6.0,
      0.0,
      -4.0
    ],
    [
      -6.0,
      0.0,
      -2.0
    ],
    [
      -8.0,
      0.0,
      -2.0
    ],
    [
      -6.0,
      0.0,
      0.0
    ],
    [
      -8.0,
      0.0,
      0.0
    ],
    [
      -6.0,
      0.0,
      2.0
    ],
    [
      -8.0,
      0.0,
      2.0
    ],
    [
      -6.0,
      0.0,
      4.0
    ],
    [
      -8.0,
      0.0,
      4.0
    ],
    [
      -4.0,
      0.0,
      -4.0
    ],
    [
      -4.0,
      0.0,
      -2.0
    ],
    [
      -4.0,
      0.0,
      0.0
    ],
    [
      -4.0,
      0.0,
      2.0
    ],
    [
      -4.0,
      0.0,
      4.0
    ],
    [
      -2.0,
      0.0,
      -4.0
    ],
    [
      -2.0,
      0.0,
      -2.0
    ],
    [
      -2.0,
      0.0,
      0.0
    ],
    [
      -2.0,
      0.0,
      2.0
    ],
    [
      -2.0,
      0.0,
      4.0
    ],
    [
      0.0,
      1.0,
      -2.0
    ],
    [
      0.0,
      1.0,
      0.0
    ],
    [
      0.0,
      1.0,
      2.0
    ],
    [
      2.0,
      2.0,
      -2.0
    ],
    [
      2.0,
      2.0,
      0.0
    ],
    [
      2.0,
      2.0,
      2.0
    ],
    [
      2.0,
      2.0,
      -4.0
    ],
    [
      4.0,
      2.0,
      -4.0
    ],
    [
      4.0,
      2.0,
      -2.0
    ],
    [
      4.0,
      2.0,
      0.0
    ],
    [
      4.0,
      2.0,
      2.0
    ],
    [
      4.0,
      2.0,
      4.0
    ],
    [
      2.0,
      2.0,
      4.0
    ],
    [
      6.0,
      2.0,
      -4.0
    ],
    [
      6.0,
      2.0,
      -2.0
    ],
    [
      6.0,
      2.0,
      0.0
    ],
    [
      6.0,
      2.0,
      2.0
    ],
    [
      6.0,
      2.0,
      4.0
    ],
    [
      8.0,
      2.0,
      -4.0
    ],
    [
      8.0,
      2.0,
      -2.0
    ],
    [
      8.0,
      2.0,
      0.0
    ],
    [
      8.0,
      2.0,
      2.0
    ],
    [
      8.0,
      2.0,
      4.0
    ],
    [
      10.0,
      0.0,
      0.0
    ],
    [
      12.0,
      0.0,
      0.0
    ],
    [
      12.0,
      0.0,
      2.0
    ],
    [
      10.0,
      0.0,
      2.0
    ]
  ],
  "triangles": [
    [
      0,
      1,
      2
    ],
    [
      0,
      2,
      3
    ],
    [
      3,
      2,
      4
    ],
    [
      3,
      4,
      5
    ],
    [
      5,
      4,
      6
    ],
    [
      5,
      6,
      7
    ],
    [
      7,
      6,
      8
    ],
    [
      7,
      8,
      9
    ],
    [
      1,
      10,
      11
    ],
    [
      1,
      11,
      2
    ],
    [
      4,
      12,
      13
    ],
    [
      4,
      13,
      6
    ],
    [
      6,
      13,
      14
    ],
    [
      6,
      14,
      8
    ],
    [
      10,
      15,
      16
    ],
    [
      10,
      16,
      11
    ],
    [
      11,
      16,
      17
    ],
    [
      11,
      17,
      12
    ],
    [
      12,
      17,
      18
    ],
    [
      12,
      18,
      13
    ],
    [
      13,
      18,
      19
    ],
    [
      13,
      19,
      14
    ],
    [
      16,
      20,
      21
    ],
    [
      16,
      21,
      17
    ],
    [
      17,
      21,
      22
    ],
    [
      17,
      22,
      18
    ],
    [
      20,
      23,
      24
    ],
    [
      20,
      24,
      21
    ],
    [
      21,
      24,
      25
    ],
    [
      21,
      25,
      22
    ],
    [
      26,
      27,
      28
    ],
    [
      26,
      28,
      23
    ],
    [
      23,
      28,
      29
    ],
    [
      23,
      29,
      24
    ],
    [
      24,
      29,
      30
    ],
    [
      24,
      30,
      25
    ],
    [
      25,
      30,
      31
    ],
    [
      25,
      31,
      32
    ],
    [
      27,
      33,
      34
    ],
    [
      27,
      34,
      28
    ],
    [
      28,
      34,
      35
    ],
    [
      28,
      35,
      29
    ],
    [
      29,
      35,
      36
    ],
    [
      29,
      36,
      30
    ],
    [
      30,
      36,
      37
    ],
    [
      30,
      37,
      31
    ],
    [
      33,
      38,
      39
    ],
    [
      33,
      39,
      34
    ],
    [
      34,
      39,
      40
    ],
    [
      34,
      40,
      35
    ],
    [
      35,
      40,
      41
    ],
    [
      35,
      41,
      36
    ],
    [
      36,
      41,
      42
    ],
    [
      36,
      42,
      37
    ],
    [
      43,
      44,
      45
    ],
    [
      43,
      45,
      46
    ]
  ]
}
